{
  "event_id": "092507-004-sample-001",
  "event_type": "LOT_DECLARED",
  "aggregate_type": "supply_lot",
  "aggregate_id": "holiday_fresh_supply-001",
  "occurred_at": "2026-09-24T12:00:00+08:00",
  "version": 1,
  "payload": {
    "supplier_id": "supplier-yu-001",
    "category": "蔬菜",
    "grade": "一级",
    "quantity": 100,
    "locked_external": 20,
    "arrival_window": {
      "start": "2026-09-25T08:00:00+08:00",
      "end": "2026-09-25T20:00:00+08:00"
    }
  }
}
